{
  "schema_version": "0.1",
  "request_id": "req-1",
  "project_id": "p-demo",
  "application_id": "a-rag",
  "question": "When was Acme founded and by whom?",
  "answer": "Acme was founded in 2018 by Jane Doe.",
  "evidence": [
    { "evidence_id": "doc-1", "content": "Acme was founded in 2018.", "source_uri": "https://example.test/acme" }
  ],
  "interaction_id": "int-1",
  "mode": "STANDARD"
}
